{
  "evaluation_time": "2026-04-15T10:00:00Z",
  "patient": {
    "date_of_birth": "1953-09-14",
    "administrative_sex": "female",
    "ancestry": ["non_hispanic_white"]
  },
  "conditions": [
    {
      "id": "cond-t2dm",
      "codes": [
        { "system": "snomed", "code": "73211009", "display": "Diabetes mellitus" },
        { "system": "icd10", "code": "E11.22", "display": "Type 2 diabetes mellitus with diabetic chronic kidney disease" }
      ],
      "clinical_status": "active",
      "verification_status": "confirmed",
      "onset_date": "2010-05-20"
    },
    {
      "id": "cond-hf",
      "codes": [
        { "system": "snomed", "code": "84114007", "display": "Heart failure" },
        { "system": "icd10", "code": "I50.9", "display": "Heart failure, unspecified" }
      ],
      "clinical_status": "active",
      "verification_status": "confirmed",
      "onset_date": "2022-11-08"
    },
    {
      "id": "cond-htn",
      "codes": [
        { "system": "snomed", "code": "38341003", "display": "Essential hypertension" },
        { "system": "icd10", "code": "I10", "display": "Essential (primary) hypertension" }
      ],
      "clinical_status": "active",
      "verification_status": "confirmed",
      "onset_date": "2008-01-15"
    }
  ],
  "observations": [
    {
      "id": "obs-hba1c-2026-01",
      "codes": [{ "system": "loinc", "code": "4548-4", "display": "Hemoglobin A1c" }],
      "status": "final",
      "effective_date": "2026-01-10T09:00:00Z",
      "value": { "value_quantity": { "value": 7.8, "unit": "%" } }
    },
    {
      "id": "obs-egfr-2026-01",
      "codes": [{ "system": "loinc", "code": "48642-3", "display": "eGFR" }],
      "status": "final",
      "effective_date": "2026-01-10T09:00:00Z",
      "value": { "value_quantity": { "value": 22, "unit": "mL/min/1.73m2" } }
    },
    {
      "id": "obs-acr-2026-01",
      "codes": [{ "system": "loinc", "code": "9318-7", "display": "Albumin/Creatinine [Mass Ratio] in Urine" }],
      "status": "final",
      "effective_date": "2026-01-10T09:00:00Z",
      "value": { "value_quantity": { "value": 250, "unit": "mg/g" } }
    },
    {
      "id": "obs-tc-2026-01",
      "codes": [{ "system": "loinc", "code": "2093-3", "display": "Cholesterol" }],
      "status": "final",
      "effective_date": "2026-01-10T09:00:00Z",
      "value": { "value_quantity": { "value": 195, "unit": "mg/dL" } }
    },
    {
      "id": "obs-hdl-2026-01",
      "codes": [{ "system": "loinc", "code": "2085-9", "display": "HDL Cholesterol" }],
      "status": "final",
      "effective_date": "2026-01-10T09:00:00Z",
      "value": { "value_quantity": { "value": 48, "unit": "mg/dL" } }
    },
    {
      "id": "obs-ldl-2026-01",
      "codes": [{ "system": "loinc", "code": "13457-7", "display": "LDL Cholesterol (calculated)" }],
      "status": "final",
      "effective_date": "2026-01-10T09:00:00Z",
      "value": { "value_quantity": { "value": 112, "unit": "mg/dL" } }
    },
    {
      "id": "obs-bp-2026-01",
      "codes": [{ "system": "loinc", "code": "85354-9", "display": "Blood pressure panel" }],
      "status": "final",
      "effective_date": "2026-01-10T08:30:00Z",
      "value": null,
      "components": [
        { "codes": [{ "system": "loinc", "code": "8480-6" }], "value": { "value_quantity": { "value": 132, "unit": "mm[Hg]" } } },
        { "codes": [{ "system": "loinc", "code": "8462-4" }], "value": { "value_quantity": { "value": 78, "unit": "mm[Hg]" } } }
      ]
    }
  ],
  "medications": [
    {
      "id": "med-metformin",
      "codes": [{ "system": "rxnorm", "code": "6809", "display": "Metformin" }],
      "status": "active",
      "intent": "order",
      "start_date": "2010-06-15"
    },
    {
      "id": "med-insulin-glargine",
      "codes": [{ "system": "rxnorm", "code": "274783", "display": "Insulin glargine" }],
      "status": "active",
      "intent": "order",
      "start_date": "2019-04-01"
    },
    {
      "id": "med-losartan",
      "codes": [{ "system": "rxnorm", "code": "52175", "display": "Losartan" }],
      "status": "active",
      "intent": "order",
      "start_date": "2015-03-10"
    },
    {
      "id": "med-furosemide",
      "codes": [{ "system": "rxnorm", "code": "4603", "display": "Furosemide" }],
      "status": "active",
      "intent": "order",
      "start_date": "2022-12-01"
    }
  ],
  "social_history": {
    "tobacco": { "status": "never", "as_of": "2026-01-10" }
  },
  "risk_scores": {
    "ascvd_10yr": {
      "name": "ascvd_10yr",
      "value": 19.5,
      "computed_date": "2026-01-10",
      "method_version": "pooled_cohort_equations_2013_goff"
    }
  },
  "completeness": {
    "medications": "populated",
    "social_history": "populated"
  }
}
