{
  "evaluation_time": "2026-04-15T10:00:00Z",
  "patient": {
    "date_of_birth": "1963-07-29",
    "administrative_sex": "male",
    "ancestry": ["black_or_african_american"]
  },
  "conditions": [
    {
      "id": "cond-mi-2024",
      "codes": [
        { "system": "snomed", "code": "22298006", "display": "Myocardial infarction" },
        { "system": "icd10", "code": "I21.9", "display": "Acute myocardial infarction, unspecified" }
      ],
      "clinical_status": "active",
      "verification_status": "confirmed",
      "onset_date": "2024-06-15"
    },
    {
      "id": "cond-htn",
      "codes": [
        { "system": "snomed", "code": "38341003", "display": "Essential hypertension" },
        { "system": "icd10", "code": "I10" }
      ],
      "clinical_status": "active",
      "verification_status": "confirmed",
      "onset_date": "2019-01-10"
    }
  ],
  "observations": [
    {
      "id": "obs-tc-2026-01",
      "codes": [{ "system": "loinc", "code": "2093-3" }],
      "status": "final",
      "effective_date": "2026-01-18T08:45:00Z",
      "value": { "value_quantity": { "value": 195, "unit": "mg/dL" } }
    },
    {
      "id": "obs-hdl-2026-01",
      "codes": [{ "system": "loinc", "code": "2085-9" }],
      "status": "final",
      "effective_date": "2026-01-18T08:45:00Z",
      "value": { "value_quantity": { "value": 38, "unit": "mg/dL" } }
    },
    {
      "id": "obs-ldl-2026-01",
      "codes": [{ "system": "loinc", "code": "13457-7" }],
      "status": "final",
      "effective_date": "2026-01-18T08:45:00Z",
      "value": { "value_quantity": { "value": 125, "unit": "mg/dL" } }
    },
    {
      "id": "obs-bp-2026-02",
      "codes": [{ "system": "loinc", "code": "85354-9" }],
      "status": "final",
      "effective_date": "2026-02-12T09:10:00Z",
      "value": null,
      "components": [
        { "codes": [{ "system": "loinc", "code": "8480-6" }], "value": { "value_quantity": { "value": 134, "unit": "mm[Hg]" } } },
        { "codes": [{ "system": "loinc", "code": "8462-4" }], "value": { "value_quantity": { "value": 82, "unit": "mm[Hg]" } } }
      ]
    }
  ],
  "medications": [
    {
      "id": "med-simvastatin-active",
      "codes": [{ "system": "rxnorm", "code": "36567", "display": "Simvastatin" }],
      "status": "active",
      "intent": "order",
      "start_date": "2024-06-20"
    },
    {
      "id": "med-lisinopril",
      "codes": [{ "system": "rxnorm", "code": "29046", "display": "Lisinopril" }],
      "status": "active",
      "intent": "order",
      "start_date": "2019-02-01"
    }
  ],
  "social_history": {
    "tobacco": { "status": "former", "as_of": "2026-02-12" }
  },
  "risk_scores": {},
  "completeness": {
    "medications": "populated",
    "social_history": "populated"
  }
}
