{
  "evaluation_time": "2026-04-15T10:00:00Z",
  "patient": {
    "date_of_birth": "1971-03-08",
    "administrative_sex": "male",
    "ancestry": ["non_hispanic_white"]
  },
  "conditions": [
    {
      "id": "cond-t2dm",
      "codes": [
        { "system": "snomed", "code": "73211009", "display": "Diabetes mellitus" },
        { "system": "icd10", "code": "E11.9", "display": "Type 2 diabetes mellitus without complications" }
      ],
      "clinical_status": "active",
      "verification_status": "confirmed",
      "onset_date": "2020-09-15"
    },
    {
      "id": "cond-htn",
      "codes": [
        { "system": "snomed", "code": "38341003", "display": "Essential hypertension" },
        { "system": "icd10", "code": "I10", "display": "Essential (primary) hypertension" }
      ],
      "clinical_status": "active",
      "verification_status": "confirmed",
      "onset_date": "2018-04-22"
    }
  ],
  "observations": [
    {
      "id": "obs-hba1c-2026-02",
      "codes": [{ "system": "loinc", "code": "4548-4", "display": "Hemoglobin A1c" }],
      "status": "final",
      "effective_date": "2026-02-10T09:00:00Z",
      "value": { "value_quantity": { "value": 7.2, "unit": "%" } }
    },
    {
      "id": "obs-egfr-2026-02",
      "codes": [{ "system": "loinc", "code": "48642-3", "display": "eGFR" }],
      "status": "final",
      "effective_date": "2026-02-10T09:00:00Z",
      "value": { "value_quantity": { "value": 85, "unit": "mL/min/1.73m2" } }
    },
    {
      "id": "obs-tc-2026-02",
      "codes": [{ "system": "loinc", "code": "2093-3", "display": "Cholesterol [Mass/volume] in Serum or Plasma" }],
      "status": "final",
      "effective_date": "2026-02-10T09:00:00Z",
      "value": { "value_quantity": { "value": 225, "unit": "mg/dL" } }
    },
    {
      "id": "obs-hdl-2026-02",
      "codes": [{ "system": "loinc", "code": "2085-9", "display": "HDL Cholesterol" }],
      "status": "final",
      "effective_date": "2026-02-10T09:00:00Z",
      "value": { "value_quantity": { "value": 41, "unit": "mg/dL" } }
    },
    {
      "id": "obs-ldl-2026-02",
      "codes": [{ "system": "loinc", "code": "13457-7", "display": "LDL Cholesterol (calculated)" }],
      "status": "final",
      "effective_date": "2026-02-10T09:00:00Z",
      "value": { "value_quantity": { "value": 152, "unit": "mg/dL" } }
    },
    {
      "id": "obs-bp-2026-03",
      "codes": [{ "system": "loinc", "code": "85354-9", "display": "Blood pressure panel" }],
      "status": "final",
      "effective_date": "2026-03-01T08:30:00Z",
      "value": null,
      "components": [
        { "codes": [{ "system": "loinc", "code": "8480-6" }], "value": { "value_quantity": { "value": 134, "unit": "mm[Hg]" } } },
        { "codes": [{ "system": "loinc", "code": "8462-4" }], "value": { "value_quantity": { "value": 82, "unit": "mm[Hg]" } } }
      ]
    }
  ],
  "medications": [
    {
      "id": "med-metformin",
      "codes": [{ "system": "rxnorm", "code": "6809", "display": "Metformin" }],
      "status": "active",
      "intent": "order",
      "start_date": "2020-10-01"
    },
    {
      "id": "med-lisinopril",
      "codes": [{ "system": "rxnorm", "code": "29046", "display": "Lisinopril" }],
      "status": "active",
      "intent": "order",
      "start_date": "2018-05-15"
    }
  ],
  "social_history": {
    "tobacco": { "status": "never", "as_of": "2026-03-01" }
  },
  "risk_scores": {
    "ascvd_10yr": {
      "name": "ascvd_10yr",
      "value": 14.0,
      "computed_date": "2026-03-01",
      "method_version": "pooled_cohort_equations_2013_goff"
    }
  },
  "completeness": {
    "medications": "populated",
    "social_history": "populated"
  }
}
