{
  "evaluation_time": "2026-04-15T10:00:00Z",
  "patient": {
    "date_of_birth": "1981-04-03",
    "administrative_sex": "male",
    "ancestry": ["non_hispanic_white"]
  },
  "conditions": [
    {
      "id": "cond-dyslipidemia",
      "codes": [
        { "system": "snomed", "code": "370992007", "display": "Dyslipidemia" },
        { "system": "icd10", "code": "E78.0", "display": "Pure hypercholesterolemia, unspecified" }
      ],
      "clinical_status": "active",
      "verification_status": "confirmed",
      "onset_date": "2021-09-15"
    },
    {
      "id": "cond-htn",
      "codes": [
        { "system": "snomed", "code": "38341003", "display": "Essential hypertension" },
        { "system": "icd10", "code": "I10", "display": "Essential (primary) hypertension" }
      ],
      "clinical_status": "active",
      "verification_status": "confirmed",
      "onset_date": "2022-01-10"
    }
  ],
  "observations": [
    {
      "id": "obs-tc-2026-01",
      "codes": [{ "system": "loinc", "code": "2093-3", "display": "Cholesterol [Mass/volume] in Serum or Plasma" }],
      "status": "final",
      "effective_date": "2026-01-15T09:00:00Z",
      "value": { "value_quantity": { "value": 298, "unit": "mg/dL" } }
    },
    {
      "id": "obs-hdl-2026-01",
      "codes": [{ "system": "loinc", "code": "2085-9", "display": "HDL Cholesterol [Mass/volume] in Serum or Plasma" }],
      "status": "final",
      "effective_date": "2026-01-15T09:00:00Z",
      "value": { "value_quantity": { "value": 45, "unit": "mg/dL" } }
    },
    {
      "id": "obs-ldl-2026-01",
      "codes": [{ "system": "loinc", "code": "13457-7", "display": "LDL Cholesterol (calculated) in Serum or Plasma" }],
      "status": "final",
      "effective_date": "2026-01-15T09:00:00Z",
      "value": { "value_quantity": { "value": 210, "unit": "mg/dL" } }
    },
    {
      "id": "obs-bp-2026-02",
      "codes": [{ "system": "loinc", "code": "85354-9", "display": "Blood pressure panel" }],
      "status": "final",
      "effective_date": "2026-02-20T08:30:00Z",
      "value": null,
      "components": [
        { "codes": [{ "system": "loinc", "code": "8480-6" }], "value": { "value_quantity": { "value": 138, "unit": "mm[Hg]" } } },
        { "codes": [{ "system": "loinc", "code": "8462-4" }], "value": { "value_quantity": { "value": 86, "unit": "mm[Hg]" } } }
      ]
    }
  ],
  "medications": [],
  "social_history": {
    "tobacco": { "status": "never", "as_of": "2026-02-20" }
  },
  "risk_scores": {
    "ascvd_10yr": {
      "name": "ascvd_10yr",
      "value": 9.5,
      "computed_date": "2026-02-20",
      "method_version": "pooled_cohort_equations_2013_goff"
    }
  },
  "completeness": {
    "medications": "populated",
    "social_history": "populated"
  }
}
