{
  "evaluation_time": "2026-04-15T10:00:00Z",
  "patient": {
    "date_of_birth": "1971-02-20",
    "administrative_sex": "male",
    "ancestry": ["non_hispanic_white"]
  },
  "conditions": [
    {
      "id": "cond-htn",
      "codes": [
        { "system": "snomed", "code": "38341003", "display": "Essential hypertension" },
        { "system": "icd10", "code": "I10", "display": "Essential (primary) hypertension" }
      ],
      "clinical_status": "active",
      "verification_status": "confirmed",
      "onset_date": "2020-03-15"
    }
  ],
  "observations": [
    {
      "id": "obs-egfr-2026-01",
      "codes": [{ "system": "loinc", "code": "48642-3", "display": "Glomerular filtration rate/1.73 sq M.predicted" }],
      "status": "final",
      "effective_date": "2026-01-20T09:00:00Z",
      "value": { "value_quantity": { "value": 52, "unit": "mL/min/1.73m2" } }
    },
    {
      "id": "obs-acr-2026-01",
      "codes": [{ "system": "loinc", "code": "9318-7", "display": "Albumin/Creatinine [Mass Ratio] in Urine" }],
      "status": "final",
      "effective_date": "2026-01-20T09:00:00Z",
      "value": { "value_quantity": { "value": 18, "unit": "mg/g" } }
    },
    {
      "id": "obs-tc-2026-02",
      "codes": [{ "system": "loinc", "code": "2093-3", "display": "Cholesterol [Mass/volume] in Serum or Plasma" }],
      "status": "final",
      "effective_date": "2026-02-15T09:00:00Z",
      "value": { "value_quantity": { "value": 228, "unit": "mg/dL" } }
    },
    {
      "id": "obs-hdl-2026-02",
      "codes": [{ "system": "loinc", "code": "2085-9", "display": "HDL Cholesterol [Mass/volume] in Serum or Plasma" }],
      "status": "final",
      "effective_date": "2026-02-15T09:00:00Z",
      "value": { "value_quantity": { "value": 44, "unit": "mg/dL" } }
    },
    {
      "id": "obs-ldl-2026-02",
      "codes": [{ "system": "loinc", "code": "13457-7", "display": "LDL Cholesterol (calculated) in Serum or Plasma" }],
      "status": "final",
      "effective_date": "2026-02-15T09:00:00Z",
      "value": { "value_quantity": { "value": 145, "unit": "mg/dL" } }
    },
    {
      "id": "obs-bp-2026-03",
      "codes": [{ "system": "loinc", "code": "85354-9", "display": "Blood pressure panel" }],
      "status": "final",
      "effective_date": "2026-03-05T08:30:00Z",
      "value": null,
      "components": [
        { "codes": [{ "system": "loinc", "code": "8480-6" }], "value": { "value_quantity": { "value": 140, "unit": "mm[Hg]" } } },
        { "codes": [{ "system": "loinc", "code": "8462-4" }], "value": { "value_quantity": { "value": 86, "unit": "mm[Hg]" } } }
      ]
    }
  ],
  "medications": [],
  "social_history": {
    "tobacco": { "status": "never", "as_of": "2026-03-05" }
  },
  "risk_scores": {
    "ascvd_10yr": {
      "name": "ascvd_10yr",
      "value": 8.5,
      "computed_date": "2026-03-05",
      "method_version": "pooled_cohort_equations_2013_goff"
    }
  },
  "completeness": {
    "medications": "populated",
    "social_history": "populated"
  }
}
