{
  "evaluation_time": "2026-04-15T10:00:00Z",
  "patient": {
    "date_of_birth": "1983-09-14",
    "administrative_sex": "female",
    "ancestry": ["non_hispanic_white"]
  },
  "conditions": [],
  "observations": [
    {
      "id": "obs-tc-2026-02",
      "codes": [{ "system": "loinc", "code": "2093-3", "display": "Cholesterol [Mass/volume] in Serum or Plasma" }],
      "status": "final",
      "effective_date": "2026-02-20T09:00:00Z",
      "value": { "value_quantity": { "value": 310, "unit": "mg/dL" } }
    },
    {
      "id": "obs-hdl-2026-02",
      "codes": [{ "system": "loinc", "code": "2085-9", "display": "HDL Cholesterol [Mass/volume] in Serum or Plasma" }],
      "status": "final",
      "effective_date": "2026-02-20T09:00:00Z",
      "value": { "value_quantity": { "value": 52, "unit": "mg/dL" } }
    },
    {
      "id": "obs-ldl-2026-02",
      "codes": [{ "system": "loinc", "code": "13457-7", "display": "LDL Cholesterol (calculated) in Serum or Plasma" }],
      "status": "final",
      "effective_date": "2026-02-20T09:00:00Z",
      "value": { "value_quantity": { "value": 230, "unit": "mg/dL" } }
    },
    {
      "id": "obs-bp-2026-03",
      "codes": [{ "system": "loinc", "code": "85354-9", "display": "Blood pressure panel" }],
      "status": "final",
      "effective_date": "2026-03-05T08:30:00Z",
      "value": null,
      "components": [
        { "codes": [{ "system": "loinc", "code": "8480-6" }], "value": { "value_quantity": { "value": 118, "unit": "mm[Hg]" } } },
        { "codes": [{ "system": "loinc", "code": "8462-4" }], "value": { "value_quantity": { "value": 72, "unit": "mm[Hg]" } } }
      ]
    }
  ],
  "medications": [],
  "social_history": {
    "tobacco": { "status": "never", "as_of": "2026-03-05" }
  },
  "completeness": {
    "medications": "populated",
    "social_history": "populated"
  }
}
