{
  "evaluation_time": "2026-04-15T10:00:00Z",
  "patient": {
    "date_of_birth": "1963-11-02",
    "administrative_sex": "female",
    "ancestry": ["non_hispanic_black"]
  },
  "conditions": [
    {
      "id": "cond-t2dm",
      "codes": [
        { "system": "snomed", "code": "73211009", "display": "Diabetes mellitus" },
        { "system": "icd10", "code": "E11.65", "display": "Type 2 diabetes mellitus with hyperglycemia" }
      ],
      "clinical_status": "active",
      "verification_status": "confirmed",
      "onset_date": "2016-03-20"
    },
    {
      "id": "cond-ascvd-stroke",
      "codes": [
        { "system": "snomed", "code": "230690007", "display": "Cerebrovascular accident" },
        { "system": "icd10", "code": "I63.9", "display": "Cerebral infarction, unspecified" }
      ],
      "clinical_status": "active",
      "verification_status": "confirmed",
      "onset_date": "2024-01-15"
    },
    {
      "id": "cond-htn",
      "codes": [
        { "system": "snomed", "code": "38341003", "display": "Essential hypertension" },
        { "system": "icd10", "code": "I10", "display": "Essential (primary) hypertension" }
      ],
      "clinical_status": "active",
      "verification_status": "confirmed",
      "onset_date": "2014-07-10"
    }
  ],
  "observations": [
    {
      "id": "obs-hba1c-2026-01",
      "codes": [{ "system": "loinc", "code": "4548-4", "display": "Hemoglobin A1c" }],
      "status": "final",
      "effective_date": "2026-01-20T09:00:00Z",
      "value": { "value_quantity": { "value": 8.5, "unit": "%" } }
    },
    {
      "id": "obs-egfr-2026-01",
      "codes": [{ "system": "loinc", "code": "48642-3", "display": "eGFR" }],
      "status": "final",
      "effective_date": "2026-01-20T09:00:00Z",
      "value": { "value_quantity": { "value": 48, "unit": "mL/min/1.73m2" } }
    },
    {
      "id": "obs-acr-2026-01",
      "codes": [{ "system": "loinc", "code": "9318-7", "display": "Albumin/Creatinine [Mass Ratio] in Urine" }],
      "status": "final",
      "effective_date": "2026-01-20T09:00:00Z",
      "value": { "value_quantity": { "value": 180, "unit": "mg/g" } }
    },
    {
      "id": "obs-tc-2026-01",
      "codes": [{ "system": "loinc", "code": "2093-3", "display": "Cholesterol" }],
      "status": "final",
      "effective_date": "2026-01-20T09:00:00Z",
      "value": { "value_quantity": { "value": 235, "unit": "mg/dL" } }
    },
    {
      "id": "obs-hdl-2026-01",
      "codes": [{ "system": "loinc", "code": "2085-9", "display": "HDL Cholesterol" }],
      "status": "final",
      "effective_date": "2026-01-20T09:00:00Z",
      "value": { "value_quantity": { "value": 38, "unit": "mg/dL" } }
    },
    {
      "id": "obs-ldl-2026-01",
      "codes": [{ "system": "loinc", "code": "13457-7", "display": "LDL Cholesterol (calculated)" }],
      "status": "final",
      "effective_date": "2026-01-20T09:00:00Z",
      "value": { "value_quantity": { "value": 158, "unit": "mg/dL" } }
    },
    {
      "id": "obs-bp-2026-02",
      "codes": [{ "system": "loinc", "code": "85354-9", "display": "Blood pressure panel" }],
      "status": "final",
      "effective_date": "2026-02-05T08:30:00Z",
      "value": null,
      "components": [
        { "codes": [{ "system": "loinc", "code": "8480-6" }], "value": { "value_quantity": { "value": 142, "unit": "mm[Hg]" } } },
        { "codes": [{ "system": "loinc", "code": "8462-4" }], "value": { "value_quantity": { "value": 88, "unit": "mm[Hg]" } } }
      ]
    }
  ],
  "medications": [
    {
      "id": "med-metformin",
      "codes": [{ "system": "rxnorm", "code": "6809", "display": "Metformin" }],
      "status": "active",
      "intent": "order",
      "start_date": "2016-04-01"
    },
    {
      "id": "med-lisinopril",
      "codes": [{ "system": "rxnorm", "code": "29046", "display": "Lisinopril" }],
      "status": "active",
      "intent": "order",
      "start_date": "2014-08-01"
    },
    {
      "id": "med-amlodipine",
      "codes": [{ "system": "rxnorm", "code": "17767", "display": "Amlodipine" }],
      "status": "active",
      "intent": "order",
      "start_date": "2020-06-15"
    }
  ],
  "social_history": {
    "tobacco": { "status": "former", "as_of": "2026-01-20" }
  },
  "risk_scores": {
    "ascvd_10yr": {
      "name": "ascvd_10yr",
      "value": 28.5,
      "computed_date": "2026-01-20",
      "method_version": "pooled_cohort_equations_2013_goff"
    }
  },
  "completeness": {
    "medications": "populated",
    "social_history": "populated"
  }
}
