{
  "evaluation_time": "2026-04-15T10:00:00Z",
  "patient": {
    "date_of_birth": "1970-11-03",
    "administrative_sex": "female",
    "ancestry": ["non_hispanic_white"]
  },
  "conditions": [
    {
      "id": "cond-dyslipidemia",
      "codes": [
        { "system": "snomed", "code": "370992007", "display": "Dyslipidemia" },
        { "system": "icd10", "code": "E78.5", "display": "Hyperlipidemia, unspecified" }
      ],
      "clinical_status": "active",
      "verification_status": "confirmed",
      "onset_date": "2023-10-11"
    },
    {
      "id": "cond-htn",
      "codes": [
        { "system": "snomed", "code": "38341003", "display": "Essential hypertension" },
        { "system": "icd10", "code": "I10" }
      ],
      "clinical_status": "active",
      "verification_status": "confirmed",
      "onset_date": "2022-04-20"
    }
  ],
  "observations": [
    {
      "id": "obs-tc-2026-01",
      "codes": [{ "system": "loinc", "code": "2093-3" }],
      "status": "final",
      "effective_date": "2026-01-22T08:45:00Z",
      "value": { "value_quantity": { "value": 240, "unit": "mg/dL" } }
    },
    {
      "id": "obs-hdl-2026-01",
      "codes": [{ "system": "loinc", "code": "2085-9" }],
      "status": "final",
      "effective_date": "2026-01-22T08:45:00Z",
      "value": { "value_quantity": { "value": 48, "unit": "mg/dL" } }
    },
    {
      "id": "obs-ldl-2026-01",
      "codes": [{ "system": "loinc", "code": "13457-7" }],
      "status": "final",
      "effective_date": "2026-01-22T08:45:00Z",
      "value": { "value_quantity": { "value": 162, "unit": "mg/dL" } }
    },
    {
      "id": "obs-bp-2026-03",
      "codes": [{ "system": "loinc", "code": "85354-9" }],
      "status": "final",
      "effective_date": "2026-03-14T10:05:00Z",
      "value": null,
      "components": [
        { "codes": [{ "system": "loinc", "code": "8480-6" }], "value": { "value_quantity": { "value": 142, "unit": "mm[Hg]" } } },
        { "codes": [{ "system": "loinc", "code": "8462-4" }], "value": { "value_quantity": { "value": 86, "unit": "mm[Hg]" } } }
      ]
    }
  ],
  "medications": [
    {
      "id": "med-lisinopril",
      "codes": [{ "system": "rxnorm", "code": "29046", "display": "Lisinopril" }],
      "status": "active",
      "intent": "order",
      "start_date": "2022-05-04"
    }
  ],
  "social_history": {
    "tobacco": { "status": "never", "as_of": "2026-03-14" }
  },
  "risk_scores": {
    "ascvd_10yr": {
      "name": "ascvd_10yr",
      "value": 8.4,
      "computed_date": "2026-03-14",
      "method_version": "pooled_cohort_equations_2013_goff"
    }
  },
  "completeness": {
    "medications": "populated",
    "social_history": "populated"
  }
}
