{
  "evaluation_time": "2026-04-15T10:00:00Z",
  "patient": {
    "date_of_birth": "1966-02-18",
    "administrative_sex": "female",
    "ancestry": ["non_hispanic_white"]
  },
  "conditions": [
    {
      "id": "cond-dyslipidemia",
      "codes": [
        { "system": "snomed", "code": "370992007", "display": "Dyslipidemia" },
        { "system": "icd10", "code": "E78.0", "display": "Pure hypercholesterolemia, unspecified" }
      ],
      "clinical_status": "active",
      "verification_status": "confirmed",
      "onset_date": "2020-03-10"
    },
    {
      "id": "cond-ckd",
      "codes": [
        { "system": "snomed", "code": "709044004", "display": "Chronic kidney disease" },
        { "system": "icd10", "code": "N18.4", "display": "Chronic kidney disease, stage 4" }
      ],
      "clinical_status": "active",
      "verification_status": "confirmed",
      "onset_date": "2022-08-15"
    },
    {
      "id": "cond-htn",
      "codes": [
        { "system": "snomed", "code": "38341003", "display": "Essential hypertension" },
        { "system": "icd10", "code": "I10", "display": "Essential (primary) hypertension" }
      ],
      "clinical_status": "active",
      "verification_status": "confirmed",
      "onset_date": "2017-01-20"
    }
  ],
  "observations": [
    {
      "id": "obs-egfr-2026-01",
      "codes": [{ "system": "loinc", "code": "48642-3", "display": "Glomerular filtration rate/1.73 sq M.predicted" }],
      "status": "final",
      "effective_date": "2026-01-20T09:00:00Z",
      "value": { "value_quantity": { "value": 22, "unit": "mL/min/1.73m2" } }
    },
    {
      "id": "obs-acr-2026-01",
      "codes": [{ "system": "loinc", "code": "9318-7", "display": "Albumin/Creatinine [Mass Ratio] in Urine" }],
      "status": "final",
      "effective_date": "2026-01-20T09:00:00Z",
      "value": { "value_quantity": { "value": 145, "unit": "mg/g" } }
    },
    {
      "id": "obs-tc-2026-01",
      "codes": [{ "system": "loinc", "code": "2093-3", "display": "Cholesterol [Mass/volume] in Serum or Plasma" }],
      "status": "final",
      "effective_date": "2026-01-20T09:00:00Z",
      "value": { "value_quantity": { "value": 280, "unit": "mg/dL" } }
    },
    {
      "id": "obs-hdl-2026-01",
      "codes": [{ "system": "loinc", "code": "2085-9", "display": "HDL Cholesterol [Mass/volume] in Serum or Plasma" }],
      "status": "final",
      "effective_date": "2026-01-20T09:00:00Z",
      "value": { "value_quantity": { "value": 48, "unit": "mg/dL" } }
    },
    {
      "id": "obs-ldl-2026-01",
      "codes": [{ "system": "loinc", "code": "13457-7", "display": "LDL Cholesterol (calculated) in Serum or Plasma" }],
      "status": "final",
      "effective_date": "2026-01-20T09:00:00Z",
      "value": { "value_quantity": { "value": 195, "unit": "mg/dL" } }
    },
    {
      "id": "obs-bp-2026-02",
      "codes": [{ "system": "loinc", "code": "85354-9", "display": "Blood pressure panel" }],
      "status": "final",
      "effective_date": "2026-02-10T08:30:00Z",
      "value": null,
      "components": [
        { "codes": [{ "system": "loinc", "code": "8480-6" }], "value": { "value_quantity": { "value": 142, "unit": "mm[Hg]" } } },
        { "codes": [{ "system": "loinc", "code": "8462-4" }], "value": { "value_quantity": { "value": 88, "unit": "mm[Hg]" } } }
      ]
    }
  ],
  "medications": [
    {
      "id": "med-losartan",
      "codes": [{ "system": "rxnorm", "code": "52175", "display": "Losartan" }],
      "status": "active",
      "intent": "order",
      "start_date": "2022-09-01"
    }
  ],
  "social_history": {
    "tobacco": { "status": "never", "as_of": "2026-02-10" }
  },
  "risk_scores": {
    "ascvd_10yr": {
      "name": "ascvd_10yr",
      "value": 14.2,
      "computed_date": "2026-02-10",
      "method_version": "pooled_cohort_equations_2013_goff"
    }
  },
  "completeness": {
    "medications": "populated",
    "social_history": "populated"
  }
}
